[
  {
    "id": "HU-Taschner-2025-Irsai-Oliver",
    "name": "Irsai Olivér",
    "producer": "Taschner borház",
    "year": 2025,
    "grape": "Irsai Olivér",
    "isCuvee": false,
    "colour": "WHITE",
    "sugar": 4.7,
    "sweetness": "DRY",
    "country": "Hungary",
    "region": "Sopron",
    "alcoholPercentage": 11.5,
    "volume": 750,
    "description": "Intenzív aromájú, csupa virág, csupa gyümölcs bor.",
    "imageUrl": "https://vinitaly.winesofhungary.hu/wp-content/uploads/2025/03/taschner_irsai_oliver_2024.png"
  },
  {
    "id": "HU-Taschner-2024-Kekfrankos",
    "name": "Kékfrankos",
    "producer": "Taschner borház",
    "year": 2024,
    "grape": "Kékfrankos",
    "isCuvee": false,
    "colour": "RED",
    "sugar": 4.7,
    "sweetness": "DRY",
    "country": "Hungary",
    "region": "Sopron",
    "alcoholPercentage": 12.5,
    "volume": 750,
    "description": "Intenzív, mély bíbor színű bor, melynek illatában meggyes, málnás, ibolyás és fűszeres, borsos jegyeket fedezhetünk fel.",
    "imageUrl": "https://vinitaly.winesofhungary.hu/wp-content/uploads/2025/03/taschner_irsai_oliver_2024.png"
  }
]